restName,restArea,restRating,restNumRev,itemCat,itemName,itemPrice,itemDesc,itemBest
Chai Point,Villaymma Layouts,4.3,1K+,Packaged Goods,Ginger Turmeric Cookies - Family Pack.,275,"Crafted for a healthy & guilt-free indulgence, Ginger Turmeric Cookies are a go to option for those seeking a light & nutritious snack",0
Chai Point,Villaymma Layouts,4.3,1K+,Packaged Goods,Filter Coffee Cookies - Family Pack.,275,"Made of oats & high-protein seeds with essence of coffee & a hint of cinnamon, the Filter Coffee Cookies are guilt free delight for all coffee lovers.",0
Chai Point,Villaymma Layouts,4.3,1K+,Packaged Goods,Banana Chips,22,"Banana chips: Made from special nedran bananas from kerala, these savory chips are light and crunchy with a twist of exciting flavours.",0
Chai Point,Villaymma Layouts,4.3,1K+,Packaged Goods,Assam Masala Tea,286,"High quality tea picked from the choicest tea gardens in Assam blended with the flavours and aromas of six spices clove, cardamom, cinnamon, ginger, black pepper and starnise. Vacuum packed to retain freshness.",0
Chai Point,Villaymma Layouts,4.3,1K+,Packaged Goods,Assam Whole Leaf Green Tea,237,High-quality whole leaf green tea picked from the choicest tea gardens in Assam and rich in anti-oxidants. Vacuum packed to retain freshness. Conforming to global sustainability norms.,0
Chai Point,Villaymma Layouts,4.3,1K+,Packaged Goods,LLT Nilgiri Orthodox Black Tea,138,"Picked from the hills of the Nilgiris, this tea is dark, intensely aromatic, fragrant and flavoured. Perfect for a strong cup of black tea or to make a refreshing cup of lemon tea.",0
Chai Point,Villaymma Layouts,4.3,1K+,Packaged Goods,LLT Nilgiri Whole Leaf Green Tea,281,"Picked from the foothills of the Nilgiris, this Whole Leaf Green Tea is light and has a distinctively earthy flavour.",0
Chai Point,Villaymma Layouts,4.3,1K+,Packaged Goods,Saffron Turmeric Latte (Pack of 10),212,"Made withreal spicessuch ascardamom, saffron,andturmeric.",0
Chai Point,Villaymma Layouts,4.3,1K+,Packaged Goods,Desi Detox Green Tea (Pack of 15),169,"Desi Detox Green Teais infused with the goodness ofTulsi, Black Pepper, Ginger,Himalayan Rock Salt,andClove.",0
Chai Point,Villaymma Layouts,4.3,1K+,Packaged Goods,Sipper Mug - Black (NEW),465,Sipper Mug - Black (NEW),0
Chai Point,Villaymma Layouts,4.3,1K+,Packaged Goods,Sipper Mug - Red (NEW),465,Sipper Mug - Red (NEW),0
Chai Point,Villaymma Layouts,4.3,1K+,Packaged Goods,Sipper Mug - Blue (NEW),592,Sipper Mug - Blue (NEW),0
