restName,restArea,restRating,restNumRev,itemCat,itemName,itemPrice,itemDesc,itemBest
Kwality Walls Frozen Dessert and Ice Cream Shop,Btm 2nd Stage,4.3,100+,New Arrivals,Trixy blueberry cheesecake Sundae,70,"Parlour like fun in a cup!
3 delicious layers - blueberry sauce, creamy cheesecake dessert  and crunchy cinnamon cookies.",0
Kwality Walls Frozen Dessert and Ice Cream Shop,Btm 2nd Stage,4.3,100+,New Arrivals,Cornetto Black Forest [110ml],65,N.A.,0
Kwality Walls Frozen Dessert and Ice Cream Shop,Btm 2nd Stage,4.3,100+,Tub 700ML,Cadbury Crackle ,349,"A Cadbury lover's delight!
Cadbury Crackle chunks in a rich creamy chocolate tub with swirls of rich chocolate sauce. A perfect partner for celebrations!",0
Kwality Walls Frozen Dessert and Ice Cream Shop,Btm 2nd Stage,4.3,100+,Tub 700ML,Choco Brownie Fudge,299,"Rich chocolate tub  full of chunky brownie pieces and chocolate fudge.  
A tub that will make a dark chocolate lover Rock N Roll.",0
Kwality Walls Frozen Dessert and Ice Cream Shop,Btm 2nd Stage,4.3,100+,Tub 700ML,"Oreo & Cream  [Tub, 700ml]",299,"The Original Oreo Tub!
Crunchy Oreo cookie chunks in rich creamy vanilla.",0
Kwality Walls Frozen Dessert and Ice Cream Shop,Btm 2nd Stage,4.3,100+,Tub 700ML,"Darkly Divine Chocolate Sensation [Tub, 700ml]            ",239,A real chocolate indulgence made with rich cocoa. Loaded with choco chips & rich chocolate sauce in every creamy scoop.,1
Kwality Walls Frozen Dessert and Ice Cream Shop,Btm 2nd Stage,4.3,100+,Tub 700ML,"Creme Caramel [Tub, 700ml]",239,"Luxurious creme caramel, beautiful golden syrup and  chunks of choco cookies  in a creamy tub.",0
Kwality Walls Frozen Dessert and Ice Cream Shop,Btm 2nd Stage,4.3,100+,Tub 700ML,"Nice Fruit & Nut [Tub, 700ml]",239,"A dry fruit lover's paradise! Crunchy cashew nuts, almond and delicious raisins in every bite of creamy scoop.",0
Kwality Walls Frozen Dessert and Ice Cream Shop,Btm 2nd Stage,4.3,100+,Tub 700ML,"Tender Coconut [Tub, 500ml] ",229,Feel naturally refreshed with every bite. Creamy tub loaded with chunks of coconut in every scoop.,0
Kwality Walls Frozen Dessert and Ice Cream Shop,Btm 2nd Stage,4.3,100+,Tub 700ML,"Butterscotch [Tub, 700ml]",175,Creamy butterscotch tub loaded with chunks of caramel coated cashew nuts.,1
Kwality Walls Frozen Dessert and Ice Cream Shop,Btm 2nd Stage,4.3,100+,Tub 700ML,"Alphonso Mango [Tub, 700ml]",170,Enjoy the delight of real  alphonso mango in a delicious creamy tub.  A fruit lover's ultimate delight!,0
Kwality Walls Frozen Dessert and Ice Cream Shop,Btm 2nd Stage,4.3,100+,Tub 700ML,"Vanilla [Tub, 700ml]",145,Rich creamy vanilla dessert thats more vanilla-tasting than any vanilla you have ever tasted in all of vanillas entirety.,0
Kwality Walls Frozen Dessert and Ice Cream Shop,Btm 2nd Stage,4.3,100+,Cake,Cassatta Cake [1000ml].,399,"A perfect cake for celebration! Creamy rainbow trio between crunchy cashew nuts, tutti frutti and soft cake.",0
Kwality Walls Frozen Dessert and Ice Cream Shop,Btm 2nd Stage,4.3,100+,Family Pack 700ML,Kesar Pista ,180,"Royal delight in every bite!
A rich and creamy scoop loaded with rich flavorful kesar and pieces of pista.",0
Kwality Walls Frozen Dessert and Ice Cream Shop,Btm 2nd Stage,4.3,100+,Family Pack 700ML,Chocolate ,145,Finest chocolate scoop made with rich cocoa. So rich & chocolatey that will make you go Choco Doodle Do.,0
Kwality Walls Frozen Dessert and Ice Cream Shop,Btm 2nd Stage,4.3,100+,Family Pack 700ML,Tutti Frutti ,150,Rich creamy scoop loaded with tiny bites of tutti fruitty.,0
Kwality Walls Frozen Dessert and Ice Cream Shop,Btm 2nd Stage,4.3,100+,Family Pack 700ML,Strawberry,120,"A fruit lover's delight.
A scoop that tastes like fresh strawberries.",0
Kwality Walls Frozen Dessert and Ice Cream Shop,Btm 2nd Stage,4.3,100+,Family Pack 700ML,Mango X 2,300,N.A.,0
Kwality Walls Frozen Dessert and Ice Cream Shop,Btm 2nd Stage,4.3,100+,Family Pack 700ML,Oreo X 2,350,N.A.,0
Kwality Walls Frozen Dessert and Ice Cream Shop,Btm 2nd Stage,4.3,100+,Family Pack 700ML,Kulfi X 2,360,N.A.,0
Kwality Walls Frozen Dessert and Ice Cream Shop,Btm 2nd Stage,4.3,100+,Family Pack 700ML,Butterscotch X 2,290,N.A.,0
Kwality Walls Frozen Dessert and Ice Cream Shop,Btm 2nd Stage,4.3,100+,Family Pack 700ML,Vanilla X 2,240,N.A.,0
Kwality Walls Frozen Dessert and Ice Cream Shop,Btm 2nd Stage,4.3,100+,Cornetto Cone,Cornetto Double Chocolate  ,40,"A yummilicious duo of milk and dark chocolate topped with chocolate sauce, chocochips in a crunchy waffle cone.",0
Kwality Walls Frozen Dessert and Ice Cream Shop,Btm 2nd Stage,4.3,100+,Magnum Ice Cream,Magnum Almond  Ice Cream,90,"Expertly crafted ice cream with Madagascar vanilla, crunchy Australian almonds and Belgian chocolate.",1
Kwality Walls Frozen Dessert and Ice Cream Shop,Btm 2nd Stage,4.3,100+,Magnum Ice Cream,Magnum Brownie Ice Cream ,90,"Expertly crafted ice cream with brownie flavour, crunchy cashew and Belgian chocolate.",1
Kwality Walls Frozen Dessert and Ice Cream Shop,Btm 2nd Stage,4.3,100+,Magnum Ice Cream,Magnum Chocolate Truffle Ice Cream,80,Rich chocolate ice cream with truffle sauce wrapped in thick Belgian chocolate.,0
Kwality Walls Frozen Dessert and Ice Cream Shop,Btm 2nd Stage,4.3,100+,Sundae & Cups 100 ML,Oreo and Cream Cup,60,Crunchy Oreo cookie chunks with rich and creamy vanilla in a cup.,1
Kwality Walls Frozen Dessert and Ice Cream Shop,Btm 2nd Stage,4.3,100+,Sundae & Cups 100 ML,Tender Coconut Cup ,50,Feel naturally refreshed with every bite. Creamy cup loaded with chunks of coconut.,1
Kwality Walls Frozen Dessert and Ice Cream Shop,Btm 2nd Stage,4.3,100+,Kulfi Ice Cream,"Kulfi Tub Ice Cream [Tub, 700ml]",265,Rich & creamy desi kulfi ice cream loaded with almonds and a twist of rose sauce. A perfect companion for hosting!,0
Kwality Walls Frozen Dessert and Ice Cream Shop,Btm 2nd Stage,4.3,100+,Kulfi Ice Cream,Kulfi Cup Ice Cream [100ml],50,"Your favourite Desi Matka Kulfi!
Rich creamy kulfi loaded with almonds - a desi delight for an  icecream lover.",1
Kwality Walls Frozen Dessert and Ice Cream Shop,Btm 2nd Stage,4.3,100+,Bundles/Combos,Aamras Sorbet Stick [60ml x 2],60,"Aamras All Year Round!
Delicious mango stick made with pulp of real alphonso mangoes.",1
Kwality Walls Frozen Dessert and Ice Cream Shop,Btm 2nd Stage,4.3,100+,Bundles/Combos,Cornetto Choco Vanilla x 4           ,140,A yummilicious duo of rich and creamy vanilla  topped with chocolate sauce and chocochips in a crunchy waffle cone,0
Craving O Clock,Btm 2nd Stage,4.3,100+,Burger,Egg Jalapeno Gherkin Burger,155,"Double egg omelette , dressed with chill garlic sauce, classic burger mayonnaise, topped with veggies, served in a toasted bun",0
Craving O Clock,Btm 2nd Stage,4.3,100+,Burger,Chicken Supreme Burger,210,"Crispy chicken patty, topped with iceberg lettuce, jalapeno, gherkin,
special creamy mayo",0
Craving O Clock,Btm 2nd Stage,4.3,100+,Burger,Crisp Cross Chicken Burger,235,"Crispy fried chicken layered with special red sauce, topped with onion slices, iceberg lettuce; dressed with burger mayo, cheese mayo.",1
Craving O Clock,Btm 2nd Stage,4.3,100+,Burger,Zinger Chicken Burger,225,"Crispy chicken patty, dressed with thousand island sauce, topped with red onions and iceberg lettuce.",1
Craving O Clock,Btm 2nd Stage,4.3,100+,Burger,Tandoori Chicken Burger,225,"Chicken slice marinated in in-house made tandoori paste; grilled to perfection , dressed and topped with special green mayo , coleslaw, veggies",0
Craving O Clock,Btm 2nd Stage,4.3,100+,Burger,Peri Peri Chicken Burger,225,"Chicken slice marinated in in-house made peri peri sauce; grilled to perfection, dressed with blend of green sauce and mayo, topped with veggies",1
Craving O Clock,Btm 2nd Stage,4.3,100+,Burger,Tandoori Zinger Chicken Burger,235,N.A.,0
Craving O Clock,Btm 2nd Stage,4.3,100+,Burger,All American Chicken Supreme Burger,325,"Double delight of a chicken patty served with onion rings, iceberg lettuce, gherkins, jalapeno; dressed with cheese mayo and burger mayo.",0
Craving O Clock,Btm 2nd Stage,4.3,100+,Burger,All American Chicken Burger,345,"Double delight of a chicken zinger served with onion rings, iceberg lettuce, gherkins, jalapeno; dressed with special yellow mayo and tandoori mayo and cheese slice.",0
Craving O Clock,Btm 2nd Stage,4.3,100+,Burger,Double Crisp Cross Chicken Burger,355,"Double crispy fried chicken layered with special red sauce, topped with onion slices, iceberg lettuce; dressed with burger mayo, cheese mayo, cheese slice, gherkin and jalapeno.",0
Craving O Clock,Btm 2nd Stage,4.3,100+,Burger,Veggie Supreme Jalapeno Burger,155,"Crispy vegetable patty, topped with veggies, special creamy mayo",1
Craving O Clock,Btm 2nd Stage,4.3,100+,Burger,Crunchy Paneer Burger,199,"Homemade paneer patty; fried to perfection, dressed with in-house blend of mayo and orange sauces, topped with fresh veggies.",1
Craving O Clock,Btm 2nd Stage,4.3,100+,Burger,All American Veg Burger,249,"Double delight of a vegetable patty and potato patty served with onion rings, iceberg lettuce, gherkins, jalapeno; dressed with cheese mayo and burger mayo.",0
Craving O Clock,Btm 2nd Stage,4.3,100+,Sandwich,Cheese Corn Grilled Sandwich,145,"Grilled sandwich with sweet corn, chopped onion, chopped coriander, dressed with cheese mayo, thousand island mayo, chilli garlic sauce and cheese slice.",0
Craving O Clock,Btm 2nd Stage,4.3,100+,Sandwich,Tandoori Paneer Sandwich,185,"Grilled sandwich with chopped onion, chopped coriander, tandoori paneer cubes; dressed with cheese mayo, tandoori mayo & thousand island mayo",0
Craving O Clock,Btm 2nd Stage,4.3,100+,Sandwich,Peri Peri Paneer Sandwich,185,"Grilled sandwich with chopped onion, chopped coriander, peri peri paneer cubes; dressed with cheese mayo, tandoori mayo & thousand island mayo",0
Craving O Clock,Btm 2nd Stage,4.3,100+,Sandwich,Classic Chicken Sandwich,199,"Grilled sandwich with boiled shredded chicken, onion, fresh coriander leaves, gherkins, jalapeno, olives; dressed with classic mayonnaise, chili garlic sauce",1
Craving O Clock,Btm 2nd Stage,4.3,100+,Sandwich,Peri Peri Chicken Sandwich,199,"Grilled sandwich with chopped onion, peri peri masala, shredded chicken, chopped coriander ; dressed with cheese mayo, chili garlic sauce, tandoori mayo",0
Craving O Clock,Btm 2nd Stage,4.3,100+,Sandwich,Tandoori Chicken Sandwich,199,"Grilled sandwich with chopped onion, tandoori masala, shredded chicken, chopped coriander; dressed with cheese mayo, chili garlic sauce, tandoori mayo",1
Craving O Clock,Btm 2nd Stage,4.3,100+,Sandwich,Chicken Club Grilled Sandwich,275,"Double decker grilled sandwich with shredded chicken, onion, sweet corn, olives, jalapeno, scrambled egg; dressed with cheese mayo, chili garlic sauce, thousand island mayo.",0
Craving O Clock,Btm 2nd Stage,4.3,100+,Wraps,Classic Paneer Wrap,235,"Crispy paneer patty, iceberg lettuce, onion; wrapped in a flour tortilla; dressed with classic mayo, tandoori mayo.",0
Craving O Clock,Btm 2nd Stage,4.3,100+,Wraps,Tandoori Paneer Wrap,235,"Tandoori grilled paneer slice, iceberg lettuce, onion; wrapped in a flour tortilla; dressed with classic mayo, tandoori mayo, chili garlic sauce.",0
Craving O Clock,Btm 2nd Stage,4.3,100+,Wraps,Peri Peri Paneer Wrap,235,"Peri peri grilled paneer slice, iceberg lettuce, onion; wrapped in a flour tortilla; dressed with classic mayo, tandoori mayo, chili garlic sauce.",0
Craving O Clock,Btm 2nd Stage,4.3,100+,Wraps,Crispy Veg Wrap,175,"Crispy vegetable patty, iceberg lettuce, onion; wrapped in a flour tortilla, dressed with classic mayo, thousand island mayo.",0
Craving O Clock,Btm 2nd Stage,4.3,100+,Wraps,Egg Wrap,158,"Egg omelette, iceberg lettuce, onion; wrapped in a flour tortilla; dressed with classic mayo, chili garlic sauce.",0
Craving O Clock,Btm 2nd Stage,4.3,100+,Wraps,Zinger Chicken Wrap,269,"Crispy fried chicken breast, iceberg lettuce, onion; wrapped in a flour tortilla; dressed with classic mayo, thousand island mayo.",1
Craving O Clock,Btm 2nd Stage,4.3,100+,Wraps,Tandoori Chicken Wrap,269,"Tandoori grilled chicken slice, iceberg lettuce, onion; wrapped in a flour tortilla; dressed with classic mayo, tandoori mayo.",0
Craving O Clock,Btm 2nd Stage,4.3,100+,Wraps,Peri Peri Chicken Wrap,269,"Peri peri grilled chicken slice, iceberg lettuce, onion; wrapped in a flour tortilla; dressed with classic mayo, tandoori mayo.",0
Craving O Clock,Btm 2nd Stage,4.3,100+,Snacks,Peri Peri French Fries,145,Crispy french fries sprinkled with homemade peri peri masala.,1
Craving O Clock,Btm 2nd Stage,4.3,100+,Mocktails,Virgin Mojito,155,Classic lemonade made with freshly squeezed lemon juice and mint leaves,1
Craving O Clock,Btm 2nd Stage,4.3,100+,Mocktails,Kala Khatta Mojito,155,"A refreshing lemonade with kala khatta syrup, lemon and indian spices",0
Craving O Clock,Btm 2nd Stage,4.3,100+,Mocktails,Green Apple Mojito,155,A refreshing lemonade with green apple crush and lemon,0
Craving O Clock,Btm 2nd Stage,4.3,100+,Mocktails,Blue Curacao Mojito,155,A refreshing lemonade with monin blue curacao syrup and lemon.,0
Craving O Clock,Btm 2nd Stage,4.3,100+,Mocktails,Mango Mojito,155,A refreshing lemonade with mango crush and lemon,0
Craving O Clock,Btm 2nd Stage,4.3,100+,Mocktails,Guava Mojito,155,A refreshing lemonade with guava crush and lemon,0
Craving O Clock,Btm 2nd Stage,4.3,100+,Mocktails,Strawberry Mojito,155,A refreshing lemonade with strawberry crush and lemon,0
Craving O Clock,Btm 2nd Stage,4.3,100+,Mocktails,Masala Mojito,155,"Classic lemonade with a twist of indian spices, made with freshly squeezed lemon juice",0
Craving O Clock,Btm 2nd Stage,4.3,100+,Mocktails,Blackcurrant Mojito,155,A refreshing lemonade with blackcurrant crush and lemon,0
Craving O Clock,Btm 2nd Stage,4.3,100+,Shakes,Choco Mocha Frappe,220,A chocolatey version of our thick cold coffee frappe,0
Craving O Clock,Btm 2nd Stage,4.3,100+,Shakes,Exotic Strawberry Shake,220,"Classic and thick shake made with vanilla ice cream, milk, strawberry crush",0
Craving O Clock,Btm 2nd Stage,4.3,100+,Shakes,Exotic Mango Shake,235,"Classic and thick shake made with vanilla ice cream, milk, mango crush",0
Craving O Clock,Btm 2nd Stage,4.3,100+,Shakes,Exotic Blackcurrant Shake,235,"Classic and thick shake made with vanilla ice cream, milk, blackcurrant crush",0
Craving O Clock,Btm 2nd Stage,4.3,100+,Shakes,Chocolate Oreo Blast,235,"A super thick chocolatey shake made with chocolate ice cream , oreo cookies, milk & chocolate sauce",0
Craving O Clock,Btm 2nd Stage,4.3,100+,Shakes,Chocolate KitKat Blast,239,"A super thick chocolatey shake made with chocolate ice cream , kitkat chocolate, milk & chocolate sauce",0
Craving O Clock,Btm 2nd Stage,4.3,100+,Shakes,Kitkat Oreo Blast,249,"A super thick chocolatey shake made with chocolate ice cream , kitkat chocolate, oreo cookies, milk & chocolate sauce",0
Chai Point,Villaymma Layouts,4.3,1K+,Hot Beverage,Ginger Chai Megaflask ( Serves 8 - 10),340,Ginger helps ease the cold or flu while also curing nausea and related stomach problems.Fresh hand pounded ginger is added to your Chai and brewed to perfection. Made with fresh milk and the best tea leaves from Assam.,0
Chai Point,Villaymma Layouts,4.3,1K+,Hot Beverage,Masala Chai Megaflask ( Serves 8 - 10),340,"Cinnamon is used to cure coughing and sore throats. Cardamom helps improve airflow to the lungs and aids healthy breathing.A handpicked blend of 6 spices - cardamom, pepper, staranise, clove, ginger and cinnamon are infused with the best tea leaves to brew your refreshing cup of Chai. Made with fresh milk.",0
Chai Point,Villaymma Layouts,4.3,1K+,Hot Beverage,Sugarless Chai Megaflask ( Serves 8 - 10),340,"The freshest tea leaves sourced from the finest estates, brewed with fresh milk without added sugar for a health-conscious beverage.",0
Chai Point,Villaymma Layouts,4.3,1K+,Hot Beverage,Ginger Chai Mini Flask ( Serves 4-5),185,Ginger helps ease the cold or flu while also curing nausea and related stomach problems.Fresh hand pounded ginger is added to your Chai and brewed to perfection. Made with fresh milk and the best tea leaves from Assam.,1
Chai Point,Villaymma Layouts,4.3,1K+,Hot Beverage,Masala Chai Mini Flask ( Serves 4-5),185,"Cinnamon is used to cure coughing and sore throats. Cardamom helps improve airflow to the lungs and aids healthy breathing.A handpicked blend of 6 spices - cardamom, pepper, staranise, clove, ginger and cinnamon are infused with the best tea leaves to brew your refreshing cup of Chai. Made with fresh milk.",0
Chai Point,Villaymma Layouts,4.3,1K+,Hot Beverage,Sugarless Chai Mini Flask ( Serves 4-5),185,"The freshest tea leaves sourced from the finest estates, brewed with fresh milk without added sugar for a health-conscious beverage.",0
Chai Point,Villaymma Layouts,4.3,1K+,Hot Beverage,Cutting Chai Megaflask ( Serves 8 - 10),340,The freshest tea leaves are sourced from the finest estates and brewed with fresh milk to you give you our most classic Chai experience.,0
Chai Point,Villaymma Layouts,4.3,1K+,Hot Beverage,Cutting Chai Mini Flask ( Serves 4-5),185,The freshest tea leaves are sourced from the finest estates and brewed with fresh milk to you give you our most classic Chai experience.,0
Chai Point,Villaymma Layouts,4.3,1K+,Hot Beverage,Masala Chai Uniflask (Serves 1-2),115,"Cinnamon is used to cure coughing and sore throats. Cardamom helps improve airflow to the lungs and aids healthy breathing.A handpicked blend of 6 spices - cardamom, pepper, staranise, clove, ginger and cinnamon are infused with the best tea leaves to brew your refreshing cup of Chai. Made with fresh milk.",0
Chai Point,Villaymma Layouts,4.3,1K+,Hot Beverage,Ginger Chai - Uniflask (Serves 1-2),115,Ginger helps ease the cold or flu while also curing nausea and related stomach problems.Fresh hand pounded ginger is added to your Chai and brewed to perfection. Made with fresh milk and the best tea leaves from Assam.,1
Chai Point,Villaymma Layouts,4.3,1K+,Hot Beverage,Cutting Chai - Uniflask (Serves 1-2),115,A piping hot flask of cutting chai delivered right to your doorstep. The flask serves 10 cups of tea and is assured to remain hot for 1 hour.,0
Chai Point,Villaymma Layouts,4.3,1K+,Hot Beverage,Kesar Elaichi Chai - UniFlask (Serves 1-2),115,Kesar is an effective tonic to treat cold and fever.Fresh cardamom and fragrant kesar added to your Chai and brewed to perfection with an almondy twist. Made with fresh milk and the best tea leaves from Assam.,0
Chai Point,Villaymma Layouts,4.3,1K+,Hot Beverage,Kesar Elaichi Chai Mini Flask ( Serves 4-5),185,Kesar is an effective tonic to treat cold and fever.Fresh cardamom and fragrant kesar added to your Chai and brewed to perfection with an almondy twist. Made with fresh milk and the best tea leaves from Assam.,0
Chai Point,Villaymma Layouts,4.3,1K+,Hot Beverage,Kesar Elaichi Chai Megaflask ( Serves 8 - 10),340,Kesar is an effective tonic to treat cold and fever.Fresh cardamom and fragrant kesar added to your Chai and brewed to perfection with an almondy twist. Made with fresh milk and the best tea leaves from Assam.,0
Chai Point,Villaymma Layouts,4.3,1K+,Hot Beverage,Irani Chai - UniFlask (Serves 1-2),115,"Rich, dense milk slow-boiled with caramelised sugar. Made with fresh milk and the best tea leaves from Assam.",0
Chai Point,Villaymma Layouts,4.3,1K+,Hot Beverage,Irani Chai Mini Flask ( Serves 4-5),185,"Rich, dense milk slow-boiled with caramelised sugar. Made with fresh milk and the best tea leaves from Assam.",0
Chai Point,Villaymma Layouts,4.3,1K+,Hot Beverage,Jaggery Chai Megaflask ( Serves 8 - 10),340,"The goodness of chai enhanced with the sweetness of jaggery, gives the jaggery chai a completely unique and memorable taste!",0
Chai Point,Villaymma Layouts,4.3,1K+,Hot Beverage,Irani Chai Megaflask ( Serves 8 - 10),340,"Rich, dense milk slow-boiled with caramelised sugar. Made with fresh milk and the best tea leaves from Assam.",0
Chai Point,Villaymma Layouts,4.3,1K+,Hot Beverage,Jaggery Chai Mini Flask ( Serves 4-5),185,"The freshest tea leaves sourced from the finest estates, brewed with fresh milk and sweetened with jaggery to you give our classic Chai experience with an earthy sweetness.",0
Chai Point,Villaymma Layouts,4.3,1K+,Hot Beverage,Jaggery Chai - Uniflask (Serves 1-2),115,"The goodness of chai enhanced with the sweetness of jaggery, gives the jaggery chai a completely unique and memorable taste.",0
Chai Point,Villaymma Layouts,4.3,1K+,Hot Beverage,Lemon Grass Megaflask ( Serves 8 - 10),340,A hint of refreshing lemongrass is infused with handpicked tea leaves to brew your lemongrass Chai. Made with fresh milk.,0
Chai Point,Villaymma Layouts,4.3,1K+,Hot Beverage,Elaichi Chai Megaflask ( Serves 8 - 10),340,Take a stroll down memory lane! Feel the warmth of real cardamoms in our earthy elaichi chai.,0
Chai Point,Villaymma Layouts,4.3,1K+,Hot Beverage,Elaichi Chai Mini Flask ( Serves 4-5),185,Take A Stroll Down Memory Lane! Feel The Warmth Of Real Cardamoms In Our Earthy Elaichi Chai.,0
Chai Point,Villaymma Layouts,4.3,1K+,Hot Beverage,Elaichi Chai - Uniflask (Serves 1-2),115,Take a stroll down memory lane! Feel the warmth of real cardamoms in our earthy elaichi chai.,0
Chai Point,Villaymma Layouts,4.3,1K+,Hot Beverage,Ayurvedic Chai - Uniflask (Serves 1-2),115,Ayurvedic Chai Uni Flask,0
Chai Point,Villaymma Layouts,4.3,1K+,Hot Beverage,Ayurvedic Chai Mini Flask ( Serves 4-5),185,"Milk Chai With The Goodness Of Ashwagandha, Tulsi, Turmeric , Mulethi, Pepper And Other Spices. A Thorough Immunity Booster.",0
Chai Point,Villaymma Layouts,4.3,1K+,Hot Beverage,Ayurvedic Chai Megaflask ( Serves 8 - 10),340,"Milk Chai With The Goodness Of Ashwagandha, Tulsi, Turmeric , Mulethi, Pepper And Other Spices. A Thorough Immunity Booster.",0
Chai Point,Villaymma Layouts,4.3,1K+,Hot Beverage,Kesar Elaichi Chai Uni Flask (No Added Sugar),115,Kesar is an effective tonic to treat cold and fever.Fresh cardamom and fragrant kesar added to your Chai and brewed to perfection with an almondy twist. Made with fresh milk and the best tea leaves from Assam. No Added Sugar.,0
Chai Point,Villaymma Layouts,4.3,1K+,Hot Beverage,Kesar Elaichi Chai Mini Flask (No Added Sugar),185,Kesar is an effective tonic to treat cold and fever.Fresh cardamom and fragrant kesar added to your Chai and brewed to perfection with an almondy twist. Made with fresh milk and the best tea leaves from Assam. No Added Sugar.,0
Chai Point,Villaymma Layouts,4.3,1K+,Hot Beverage,Kesar Elaichi Chai Mega Flask (No Added Sugar),340,Kesar is an effective tonic to treat cold and fever.Fresh cardamom and fragrant kesar added to your Chai and brewed to perfection with an almondy twist. Made with fresh milk and the best tea leaves from Assam. No Added Sugar.,0
Chai Point,Villaymma Layouts,4.3,1K+,Hot Beverage,Lemon Chai Megaflask ( Serves 8 - 10),340,Freshly squeezed lemon is added to your Chai and brewed to perfection. Made with fresh tea leaves sourced from the best gardens.,0
Chai Point,Villaymma Layouts,4.3,1K+,Hot Beverage,Hot Green Chai Megaflask ( Serves 8 - 10),340,Our green chai is a healthy option infused with cardamom and cinnamon.,0
Chai Point,Villaymma Layouts,4.3,1K+,Hot Beverage,Ginger Lemon Chai Megaflask ( Serves 8 - 10),340,Ginger helps ease the cold or flu and relieves nausea. Lemon strengthens your immune system and helps fight the common cold.Fresh hand pounded ginger and lemon juice is added to your Chai and brewed to perfection. Made with fresh tea leaves sourced from the best gardens.,0
Chai Point,Villaymma Layouts,4.3,1K+,Hot Beverage,Lemon Chai Mini Flask ( Serves 4-5),185,Freshly squeezed lemon is added to your Chai and brewed to perfection. Made with fresh tea leaves sourced from the best gardens.,0
Chai Point,Villaymma Layouts,4.3,1K+,Hot Beverage,Ginger Lemon Mini Flask ( Serves 4-5),185,Ginger helps ease the cold or flu and relieves nausea. Lemon strengthens your immune system and helps fight the common cold.Fresh hand pounded ginger and lemon juice is added to your Chai and brewed to perfection. Made with fresh tea leaves sourced from the best gardens.,0
Chai Point,Villaymma Layouts,4.3,1K+,Hot Beverage,Hot Green Chai Mini Flask ( Serves 4-5),185,Mini Flask - 500 ML (Serves 4-5),0
Chai Point,Villaymma Layouts,4.3,1K+,Hot Beverage,Lemon Chai - Uniflask (Serves 1-2),115,Freshly squeezed lemon is added to your Chai and brewed to perfection. Made with fresh tea leaves sourced from the best gardens.,0
Chai Point,Villaymma Layouts,4.3,1K+,Hot Beverage,Hot Green Chai - Uniflask (Serves 1-2),115,Our green chai is a healthy option infused with cardamom and cinnamon.,0
Chai Point,Villaymma Layouts,4.3,1K+,Hot Beverage,Lemon Grass Mini Flask ( Serves 4-5),185,A hint of refreshing lemongrass is infused with handpicked tea leaves to brew your lemongrass Chai. Made with fresh milk.,0
Chai Point,Villaymma Layouts,4.3,1K+,Hot Beverage,Lemon Grass - Uniflask (Serves 1-2),115,A hint of refreshing lemongrass is infused with handpicked tea leaves to brew your lemongrass Chai. Made with fresh milk.,0
Chai Point,Villaymma Layouts,4.3,1K+,Hot Beverage,Sulemani Chai Megaflask ( Serves 8 - 10),340,"Cloves are rich in anti-oxidants while lemon strengthens your immune system and helps fight the common cold.The goodness of cardamom, clove and cinnamon pounded and infused with fresh lemon-ginger juice and the finest tea leaves for a refreshing edge to your favourite beverage.",0
Chai Point,Villaymma Layouts,4.3,1K+,Hot Beverage,Sulemani Chai Mini Flask ( Serves 4-5),185,"Cloves are rich in anti-oxidants while lemon strengthens your immune system and helps fight the common cold.The goodness of cardamom, clove and cinnamon pounded and infused with fresh lemon-ginger juice and the finest tea leaves for a refreshing edge to your favourite beverage.",0
